<?xml version="1.0" ?>
<!DOCTYPE DeepVideoUnderstandingResults SYSTEM "DeepVideoUnderstandingResults.dtd">
<DeepVideoUnderstandingResults movie="little_rock">
	<DeepVideoUnderstandingRunResult desc="A Multi-Stream Approach for Video Understanding" pid="UZH" priority="1">
		<DeepVideoUnderstandingTopicResult question="1" id="1" path="1">
			<item source="francisco" relation="friend of" target="dad"/>
			<item source="dad" relation="friend of" target="brody"/>
			<item source="brody" relation="friend of" target="atsuko"/>
			<item source="atsuko" relation="friend of" target="cory"/>
			<item source="cory" relation="friend of" target="garbo"/>
		</DeepVideoUnderstandingTopicResult>
		<DeepVideoUnderstandingTopicResult question="1" id="1" path="2">
			<item source="francisco" relation="friend of" target="dad"/>
			<item source="dad" relation="friend of" target="brody"/>
			<item source="brody" relation="friend of" target="atsuko"/>
			<item source="atsuko" relation="friend of" target="cory"/>
			<item source="cory" relation="lives at" target="house2"/>
			<item source="house2" relation="residence of" target="garbo"/>
		</DeepVideoUnderstandingTopicResult>
		<DeepVideoUnderstandingTopicResult question="1" id="1" path="3">
			<item source="francisco" relation="friend of" target="dad"/>
			<item source="dad" relation="friend of" target="brody"/>
			<item source="brody" relation="friend of" target="atsuko"/>
			<item source="atsuko" relation="friend of" target="cory"/>
			<item source="cory" relation="lives at" target="shop"/>
			<item source="shop" relation="residence of" target="garbo"/>
		</DeepVideoUnderstandingTopicResult>
		<DeepVideoUnderstandingTopicResult question="1" id="1" path="4">
			<item source="francisco" relation="friend of" target="dad"/>
			<item source="dad" relation="friend of" target="brody"/>
			<item source="brody" relation="friend of" target="garbo"/>
		</DeepVideoUnderstandingTopicResult>
		<DeepVideoUnderstandingTopicResult question="1" id="1" path="5">
			<item source="francisco" relation="friend of" target="dad"/>
			<item source="dad" relation="friend of" target="cory"/>
			<item source="cory" relation="friend of" target="atsuko"/>
			<item source="atsuko" relation="friend of" target="brody"/>
			<item source="brody" relation="friend of" target="garbo"/>
		</DeepVideoUnderstandingTopicResult>
		<DeepVideoUnderstandingTopicResult question="1" id="1" path="6">
			<item source="francisco" relation="friend of" target="dad"/>
			<item source="dad" relation="friend of" target="cory"/>
			<item source="cory" relation="friend of" target="garbo"/>
		</DeepVideoUnderstandingTopicResult>
		<DeepVideoUnderstandingTopicResult question="1" id="1" path="7">
			<item source="francisco" relation="friend of" target="dad"/>
			<item source="dad" relation="friend of" target="cory"/>
			<item source="cory" relation="lives at" target="house2"/>
			<item source="house2" relation="residence of" target="garbo"/>
		</DeepVideoUnderstandingTopicResult>
		<DeepVideoUnderstandingTopicResult question="1" id="1" path="8">
			<item source="francisco" relation="friend of" target="dad"/>
			<item source="dad" relation="friend of" target="cory"/>
			<item source="cory" relation="lives at" target="shop"/>
			<item source="shop" relation="residence of" target="garbo"/>
		</DeepVideoUnderstandingTopicResult>
		<DeepVideoUnderstandingTopicResult question="1" id="1" path="9">
			<item source="francisco" relation="friend of" target="dad"/>
			<item source="dad" relation="friend of" target="garbo"/>
		</DeepVideoUnderstandingTopicResult>
		<DeepVideoUnderstandingTopicResult question="1" id="2" path="1">
			<item source="jordan" relation="friend of" target="dad"/>
			<item source="dad" relation="friend of" target="sean"/>
		</DeepVideoUnderstandingTopicResult>
		<DeepVideoUnderstandingTopicResult question="1" id="3" path="1">
			<item source="brody" relation="friend of" target="atsuko"/>
			<item source="atsuko" relation="friend of" target="cory"/>
			<item source="cory" relation="friend of" target="dad"/>
			<item source="dad" relation="friend of" target="marques"/>
		</DeepVideoUnderstandingTopicResult>
		<DeepVideoUnderstandingTopicResult question="1" id="3" path="2">
			<item source="brody" relation="friend of" target="atsuko"/>
			<item source="atsuko" relation="friend of" target="cory"/>
			<item source="cory" relation="friend of" target="garbo"/>
			<item source="garbo" relation="friend of" target="dad"/>
			<item source="dad" relation="friend of" target="marques"/>
		</DeepVideoUnderstandingTopicResult>
		<DeepVideoUnderstandingTopicResult question="1" id="3" path="3">
			<item source="brody" relation="friend of" target="atsuko"/>
			<item source="atsuko" relation="friend of" target="cory"/>
			<item source="cory" relation="lives at" target="house2"/>
			<item source="house2" relation="residence of" target="garbo"/>
			<item source="garbo" relation="friend of" target="dad"/>
			<item source="dad" relation="friend of" target="marques"/>
		</DeepVideoUnderstandingTopicResult>
		<DeepVideoUnderstandingTopicResult question="1" id="3" path="4">
			<item source="brody" relation="friend of" target="atsuko"/>
			<item source="atsuko" relation="friend of" target="cory"/>
			<item source="cory" relation="lives at" target="shop"/>
			<item source="shop" relation="residence of" target="garbo"/>
			<item source="garbo" relation="friend of" target="dad"/>
			<item source="dad" relation="friend of" target="marques"/>
		</DeepVideoUnderstandingTopicResult>
		<DeepVideoUnderstandingTopicResult question="1" id="3" path="5">
			<item source="brody" relation="friend of" target="dad"/>
			<item source="dad" relation="friend of" target="marques"/>
		</DeepVideoUnderstandingTopicResult>
		<DeepVideoUnderstandingTopicResult question="1" id="3" path="6">
			<item source="brody" relation="friend of" target="garbo"/>
			<item source="garbo" relation="friend of" target="cory"/>
			<item source="cory" relation="friend of" target="dad"/>
			<item source="dad" relation="friend of" target="marques"/>
		</DeepVideoUnderstandingTopicResult>
		<DeepVideoUnderstandingTopicResult question="1" id="3" path="7">
			<item source="brody" relation="friend of" target="garbo"/>
			<item source="garbo" relation="friend of" target="dad"/>
			<item source="dad" relation="friend of" target="marques"/>
		</DeepVideoUnderstandingTopicResult>
		<DeepVideoUnderstandingTopicResult question="1" id="3" path="8">
			<item source="brody" relation="friend of" target="garbo"/>
			<item source="garbo" relation="lives at" target="house2"/>
			<item source="house2" relation="residence of" target="cory"/>
			<item source="cory" relation="friend of" target="dad"/>
			<item source="dad" relation="friend of" target="marques"/>
		</DeepVideoUnderstandingTopicResult>
		<DeepVideoUnderstandingTopicResult question="1" id="3" path="9">
			<item source="brody" relation="friend of" target="garbo"/>
			<item source="garbo" relation="lives at" target="shop"/>
			<item source="shop" relation="residence of" target="cory"/>
			<item source="cory" relation="friend of" target="dad"/>
			<item source="dad" relation="friend of" target="marques"/>
		</DeepVideoUnderstandingTopicResult>
		<DeepVideoUnderstandingTopicResult question="2" id="1">
			<item order="1" subject="none" confidence="0"/>
		</DeepVideoUnderstandingTopicResult>
		<DeepVideoUnderstandingTopicResult question="2" id="2">
			<item order="1" subject="none" confidence="0"/>
		</DeepVideoUnderstandingTopicResult>
		<DeepVideoUnderstandingTopicResult question="2" id="3">
			<item order="1" subject="atsuko" confidence="33"/>
			<item order="2" subject="dad" confidence="33"/>
			<item order="3" subject="garbo" confidence="33"/>
		</DeepVideoUnderstandingTopicResult>
		<DeepVideoUnderstandingTopicResult question="2" id="4">
			<item order="1" subject="none" confidence="0"/>
		</DeepVideoUnderstandingTopicResult>
		<DeepVideoUnderstandingTopicResult question="3" id="1">
			<item type="Relation" answer="None"/>
		</DeepVideoUnderstandingTopicResult>
		<DeepVideoUnderstandingTopicResult question="3" id="2">
			<item type="Relation" answer="None"/>
		</DeepVideoUnderstandingTopicResult>
		<DeepVideoUnderstandingTopicResult question="3" id="3">
			<item type="Relation" answer="None"/>
		</DeepVideoUnderstandingTopicResult>
		<DeepVideoUnderstandingTopicResult question="3" id="4">
			<item type="Entity" answer="unknown"/>
		</DeepVideoUnderstandingTopicResult>
		<DeepVideoUnderstandingTopicResult question="3" id="5">
			<item type="Relation" answer="None"/>
		</DeepVideoUnderstandingTopicResult>
		<DeepVideoUnderstandingTopicResult question="3" id="6">
			<item type="Integer" answer="0"/>
		</DeepVideoUnderstandingTopicResult>
		<DeepVideoUnderstandingTopicResult question="3" id="7">
			<item type="Relation" answer="unknown"/>
		</DeepVideoUnderstandingTopicResult>
	</DeepVideoUnderstandingRunResult>
</DeepVideoUnderstandingResults>
